{"$schema":"http://json-schema.org/draft-07/schema#","$id":"stegverse_llm_adapter_instruction_packet.schema.json","title":"StegVerse LLM Adapter Instruction Packet v1","type":"object","required":["schema","packet_id","source_provider","target_entity","target_stage","decision","stop_condition"],"properties":{"schema":{"type":"string","const":"stegverse_llm_adapter_instruction_packet.v1"},"packet_id":{"type":"string"},"source_provider":{"type":"string"},"source_model":{"type":"string"},"source_session":{"type":"string"},"prompt_hash":{"type":"string"},"response_hash":{"type":"string"},"operator":{"type":"string"},"target_entity":{"type":"string"},"target_stage":{"type":"string"},"target_scope":{"type":"string"},"transition_class":{"type":"string"},"allowed_action":{"type":"string"},"forbidden_actions":{"type":"array","items":{"type":"string"}},"risk_classification":{"type":"string"},"stop_condition":{"type":"string"},"decision":{"type":"string"},"basis":{"type":"string"},"receipt_hash":{"type":"string"},"created_at":{"type":"string"}}}
